{
  "$schema": "https://json-schema.org/draft/2020-12/schema",
  "title": "Review sensitivity (sensitivity_version 1.0)",
  "description": "artifacts/review_sensitivity.json: per method, the accept-threshold sweep from 0.50 to 0.99 with review queue size, expected false accepts and total cost per false-accept cost ratio, and the chosen thresholds beside the curve (docs/BRIEF.md 2.8). Test fold. Counts and numbers only.",
  "type": "object",
  "required": [
    "sensitivity_version",
    "generated_at_utc",
    "feature_version",
    "code_commit",
    "methods"
  ],
  "additionalProperties": false,
  "properties": {
    "sensitivity_version": {
      "const": "1.0"
    },
    "generated_at_utc": {
      "type": "string"
    },
    "feature_version": {
      "type": "string"
    },
    "code_commit": {
      "type": "string"
    },
    "methods": {
      "type": "object",
      "propertyNames": {
        "enum": [
          "exact_v1",
          "rules_v1",
          "learned_v1"
        ]
      },
      "additionalProperties": {
        "type": "object",
        "required": [
          "review_cost_units",
          "false_accept_cost_ratios",
          "review_min",
          "chosen_accept_threshold",
          "points",
          "review_floor_sweep"
        ],
        "additionalProperties": false,
        "properties": {
          "review_cost_units": {
            "type": "number",
            "minimum": 0
          },
          "false_accept_cost_ratios": {
            "type": "array",
            "items": {
              "type": "number",
              "minimum": 0
            }
          },
          "review_min": {
            "type": "number",
            "minimum": 0,
            "maximum": 1
          },
          "chosen_accept_threshold": {
            "type": "number",
            "minimum": 0,
            "maximum": 1
          },
          "points": {
            "type": "array",
            "items": {
              "type": "object",
              "required": [
                "threshold",
                "accepts",
                "queue_floor",
                "queue_ambiguity",
                "review_queue",
                "precision_labelled",
                "expected_false_accepts",
                "total_cost"
              ],
              "additionalProperties": false,
              "properties": {
                "threshold": {
                  "type": "number",
                  "minimum": 0,
                  "maximum": 1
                },
                "accepts": {
                  "type": "integer",
                  "minimum": 0
                },
                "review_queue": {
                  "type": "integer",
                  "minimum": 0
                },
                "precision_labelled": {
                  "type": [
                    "number",
                    "null"
                  ],
                  "minimum": 0,
                  "maximum": 1
                },
                "expected_false_accepts": {
                  "type": [
                    "number",
                    "null"
                  ],
                  "minimum": 0
                },
                "total_cost": {
                  "type": "object",
                  "additionalProperties": {
                    "type": [
                      "number",
                      "null"
                    ],
                    "minimum": 0
                  }
                },
                "queue_floor": {
                  "type": "integer",
                  "minimum": 0
                },
                "queue_ambiguity": {
                  "type": "integer",
                  "minimum": 0
                }
              }
            }
          },
          "review_floor_sweep": {
            "type": "object",
            "required": [
              "accept_min",
              "n_test_a",
              "n_labelled_reachable",
              "floors_omitted_at_or_above_accept_min",
              "points"
            ],
            "additionalProperties": false,
            "properties": {
              "accept_min": {
                "type": "number",
                "minimum": 0,
                "maximum": 1
              },
              "n_test_a": {
                "type": "integer",
                "minimum": 0
              },
              "n_labelled_reachable": {
                "type": "integer",
                "minimum": 0
              },
              "points": {
                "type": "array",
                "items": {
                  "type": "object",
                  "required": [
                    "floor",
                    "queue_floor",
                    "queue_ambiguity",
                    "queue_total",
                    "queue_share_of_test_a",
                    "recall_with_review"
                  ],
                  "additionalProperties": false,
                  "properties": {
                    "floor": {
                      "type": "number",
                      "minimum": 0,
                      "maximum": 1
                    },
                    "queue_floor": {
                      "type": "integer",
                      "minimum": 0
                    },
                    "queue_ambiguity": {
                      "type": "integer",
                      "minimum": 0
                    },
                    "queue_total": {
                      "type": "integer",
                      "minimum": 0
                    },
                    "queue_share_of_test_a": {
                      "type": [
                        "number",
                        "null"
                      ],
                      "minimum": 0,
                      "maximum": 1
                    },
                    "recall_with_review": {
                      "type": [
                        "number",
                        "null"
                      ],
                      "minimum": 0,
                      "maximum": 1
                    }
                  }
                }
              },
              "floors_omitted_at_or_above_accept_min": {
                "type": "array",
                "items": {
                  "type": "number",
                  "minimum": 0,
                  "maximum": 1
                }
              }
            }
          }
        }
      }
    }
  }
}
