{
  "code_commit": "6b3124b176ea8ffaf198c3ee6aa966cd6a2eccb4",
  "feature_version": "0.2.0",
  "generated_at_utc": "2026-09-23T14:16:02+00:00",
  "methods": {
    "exact_v1": {
      "chosen_accept_threshold": 0.95,
      "false_accept_cost_ratios": [
        1,
        5,
        20
      ],
      "points": [
        {
          "accepts": 36529,
          "expected_false_accepts": 46.278,
          "precision_labelled": 0.998733,
          "queue_ambiguity": 207,
          "queue_floor": 0,
          "review_queue": 207,
          "threshold": 0.5,
          "total_cost": {
            "1": 253.278,
            "20": 1132.56,
            "5": 438.39
          }
        },
        {
          "accepts": 36529,
          "expected_false_accepts": 46.278,
          "precision_labelled": 0.998733,
          "queue_ambiguity": 207,
          "queue_floor": 0,
          "review_queue": 207,
          "threshold": 0.51,
          "total_cost": {
            "1": 253.278,
            "20": 1132.56,
            "5": 438.39
          }
        },
        {
          "accepts": 36529,
          "expected_false_accepts": 46.278,
          "precision_labelled": 0.998733,
          "queue_ambiguity": 207,
          "queue_floor": 0,
          "review_queue": 207,
          "threshold": 0.52,
          "total_cost": {
            "1": 253.278,
            "20": 1132.56,
            "5": 438.39
          }
        },
        {
          "accepts": 36529,
          "expected_false_accepts": 46.278,
          "precision_labelled": 0.998733,
          "queue_ambiguity": 207,
          "queue_floor": 0,
          "review_queue": 207,
          "threshold": 0.53,
          "total_cost": {
            "1": 253.278,
            "20": 1132.56,
            "5": 438.39
          }
        },
        {
          "accepts": 36529,
          "expected_false_accepts": 46.278,
          "precision_labelled": 0.998733,
          "queue_ambiguity": 207,
          "queue_floor": 0,
          "review_queue": 207,
          "threshold": 0.54,
          "total_cost": {
            "1": 253.278,
            "20": 1132.56,
            "5": 438.39
          }
        },
        {
          "accepts": 36529,
          "expected_false_accepts": 46.278,
          "precision_labelled": 0.998733,
          "queue_ambiguity": 207,
          "queue_floor": 0,
          "review_queue": 207,
          "threshold": 0.55,
          "total_cost": {
            "1": 253.278,
            "20": 1132.56,
            "5": 438.39
          }
        },
        {
          "accepts": 36529,
          "expected_false_accepts": 46.278,
          "precision_labelled": 0.998733,
          "queue_ambiguity": 207,
          "queue_floor": 0,
          "review_queue": 207,
          "threshold": 0.56,
          "total_cost": {
            "1": 253.278,
            "20": 1132.56,
            "5": 438.39
          }
        },
        {
          "accepts": 36529,
          "expected_false_accepts": 46.278,
          "precision_labelled": 0.998733,
          "queue_ambiguity": 207,
          "queue_floor": 0,
          "review_queue": 207,
          "threshold": 0.57,
          "total_cost": {
            "1": 253.278,
            "20": 1132.56,
            "5": 438.39
          }
        },
        {
          "accepts": 36529,
          "expected_false_accepts": 46.278,
          "precision_labelled": 0.998733,
          "queue_ambiguity": 207,
          "queue_floor": 0,
          "review_queue": 207,
          "threshold": 0.58,
          "total_cost": {
            "1": 253.278,
            "20": 1132.56,
            "5": 438.39
          }
        },
        {
          "accepts": 36529,
          "expected_false_accepts": 46.278,
          "precision_labelled": 0.998733,
          "queue_ambiguity": 207,
          "queue_floor": 0,
          "review_queue": 207,
          "threshold": 0.59,
          "total_cost": {
            "1": 253.278,
            "20": 1132.56,
            "5": 438.39
          }
        },
        {
          "accepts": 36529,
          "expected_false_accepts": 46.278,
          "precision_labelled": 0.998733,
          "queue_ambiguity": 207,
          "queue_floor": 0,
          "review_queue": 207,
          "threshold": 0.6,
          "total_cost": {
            "1": 253.278,
            "20": 1132.56,
            "5": 438.39
          }
        },
        {
          "accepts": 36529,
          "expected_false_accepts": 46.278,
          "precision_labelled": 0.998733,
          "queue_ambiguity": 207,
          "queue_floor": 0,
          "review_queue": 207,
          "threshold": 0.61,
          "total_cost": {
            "1": 253.278,
            "20": 1132.56,
            "5": 438.39
          }
        },
        {
          "accepts": 36529,
          "expected_false_accepts": 46.278,
          "precision_labelled": 0.998733,
          "queue_ambiguity": 207,
          "queue_floor": 0,
          "review_queue": 207,
          "threshold": 0.62,
          "total_cost": {
            "1": 253.278,
            "20": 1132.56,
            "5": 438.39
          }
        },
        {
          "accepts": 36529,
          "expected_false_accepts": 46.278,
          "precision_labelled": 0.998733,
          "queue_ambiguity": 207,
          "queue_floor": 0,
          "review_queue": 207,
          "threshold": 0.63,
          "total_cost": {
            "1": 253.278,
            "20": 1132.56,
            "5": 438.39
          }
        },
        {
          "accepts": 36529,
          "expected_false_accepts": 46.278,
          "precision_labelled": 0.998733,
          "queue_ambiguity": 207,
          "queue_floor": 0,
          "review_queue": 207,
          "threshold": 0.64,
          "total_cost": {
            "1": 253.278,
            "20": 1132.56,
            "5": 438.39
          }
        },
        {
          "accepts": 36529,
          "expected_false_accepts": 46.278,
          "precision_labelled": 0.998733,
          "queue_ambiguity": 207,
          "queue_floor": 0,
          "review_queue": 207,
          "threshold": 0.65,
          "total_cost": {
            "1": 253.278,
            "20": 1132.56,
            "5": 438.39
          }
        },
        {
          "accepts": 36529,
          "expected_false_accepts": 46.278,
          "precision_labelled": 0.998733,
          "queue_ambiguity": 207,
          "queue_floor": 0,
          "review_queue": 207,
          "threshold": 0.66,
          "total_cost": {
            "1": 253.278,
            "20": 1132.56,
            "5": 438.39
          }
        },
        {
          "accepts": 36529,
          "expected_false_accepts": 46.278,
          "precision_labelled": 0.998733,
          "queue_ambiguity": 207,
          "queue_floor": 0,
          "review_queue": 207,
          "threshold": 0.67,
          "total_cost": {
            "1": 253.278,
            "20": 1132.56,
            "5": 438.39
          }
        },
        {
          "accepts": 36529,
          "expected_false_accepts": 46.278,
          "precision_labelled": 0.998733,
          "queue_ambiguity": 207,
          "queue_floor": 0,
          "review_queue": 207,
          "threshold": 0.68,
          "total_cost": {
            "1": 253.278,
            "20": 1132.56,
            "5": 438.39
          }
        },
        {
          "accepts": 36529,
          "expected_false_accepts": 46.278,
          "precision_labelled": 0.998733,
          "queue_ambiguity": 207,
          "queue_floor": 0,
          "review_queue": 207,
          "threshold": 0.69,
          "total_cost": {
            "1": 253.278,
            "20": 1132.56,
            "5": 438.39
          }
        },
        {
          "accepts": 36529,
          "expected_false_accepts": 46.278,
          "precision_labelled": 0.998733,
          "queue_ambiguity": 207,
          "queue_floor": 0,
          "review_queue": 207,
          "threshold": 0.7,
          "total_cost": {
            "1": 253.278,
            "20": 1132.56,
            "5": 438.39
          }
        },
        {
          "accepts": 36529,
          "expected_false_accepts": 46.278,
          "precision_labelled": 0.998733,
          "queue_ambiguity": 207,
          "queue_floor": 0,
          "review_queue": 207,
          "threshold": 0.71,
          "total_cost": {
            "1": 253.278,
            "20": 1132.56,
            "5": 438.39
          }
        },
        {
          "accepts": 36529,
          "expected_false_accepts": 46.278,
          "precision_labelled": 0.998733,
          "queue_ambiguity": 207,
          "queue_floor": 0,
          "review_queue": 207,
          "threshold": 0.72,
          "total_cost": {
            "1": 253.278,
            "20": 1132.56,
            "5": 438.39
          }
        },
        {
          "accepts": 36529,
          "expected_false_accepts": 46.278,
          "precision_labelled": 0.998733,
          "queue_ambiguity": 207,
          "queue_floor": 0,
          "review_queue": 207,
          "threshold": 0.73,
          "total_cost": {
            "1": 253.278,
            "20": 1132.56,
            "5": 438.39
          }
        },
        {
          "accepts": 36529,
          "expected_false_accepts": 46.278,
          "precision_labelled": 0.998733,
          "queue_ambiguity": 207,
          "queue_floor": 0,
          "review_queue": 207,
          "threshold": 0.74,
          "total_cost": {
            "1": 253.278,
            "20": 1132.56,
            "5": 438.39
          }
        },
        {
          "accepts": 36529,
          "expected_false_accepts": 46.278,
          "precision_labelled": 0.998733,
          "queue_ambiguity": 207,
          "queue_floor": 0,
          "review_queue": 207,
          "threshold": 0.75,
          "total_cost": {
            "1": 253.278,
            "20": 1132.56,
            "5": 438.39
          }
        },
        {